[
 {
  "id": "sched-2026-11-24-sidem-daimaru-vol2-2026-千秋楽",
  "dedup_key": "sidem-daimaru-vol2-2026",
  "brand": "sidem",
  "subject": "SideM×大丸松坂屋 第2弾 大丸梅田店 最終日",
  "kind": "千秋楽",
  "note": "大丸梅田1Fで買える最終日(20:00まで)",
  "reserved_on": "2026-10-09",
  "title": "SideM×DAIMARU MATSUZAKAYA VOL.2",
  "url": "https://x.com/SideM_official/status/2107742725109858360",
  "source_type": "公式",
  "facts": [
   "アイドルマスター SideM×大丸松坂屋百貨店のコラボレーション企画第二弾。",
   "雑誌撮影を思わせる描き下ろしビジュアルを使用。",
   "アパレル商品にチャーム付きトートバッグ(13,200円)、キルティングポーチ〈Black / White〉(4,400円)、キルティングIDケース〈Black / White〉(5,500円)、スカーフ〈全6種〉(4,400円)。いずれも税込。",
   "グッズにアクリルスタンド〈全6種〉(2,200円)、アクリルブロック〈全7種〉(3,630円)、ポストカードセット(1,540円)、ステッカーセット(1,650円)、アクリルキーホルダー(12種、880円)、缶バッジ(12種、660円)。いずれも税込。",
   "アクリルキーホルダーと缶バッジはコンプリートセットの販売もある。",
   "ポップアップショップ・オンライン受注販売で3,300円(税込)以上購入ごとにオリジナルクリアカードをプレゼント。全6種で絵柄は選べない。",
   "ポップアップショップでの特典は、数がなくなり次第終了。",
   "東京会場は大丸東京3Fイベントスペース、2026年10月28日(水)～11月10日(火)、営業時間10:00～20:00。",
   "梅田会場は大丸梅田1Fイベントスペース、2026年11月18日(水)～11月24日(火)、営業時間10:00～20:00。",
   "混雑時は入場制限や入場整理券を配布する場合がある。",
   "一部商品はオンラインでの受注販売を予定。",
   "リンク: https://caltla.com/pages/the-idolmaster-sidem2",
   "エンゲージメント: 高"
  ],
  "via": "grok",
  "verify": "confirmed",
  "src_candidate_id": "202610090223-grok-46",
  "event_date": "2026-10-28",
  "deadline": "2026-11-24"
 },
 {
  "id": "sched-2026-11-24-sidem-daimaru-vol2-2026-千秋楽-src1",
  "dedup_key": "sidem-daimaru-vol2-2026",
  "brand": "sidem",
  "subject": "SideM×大丸松坂屋 第2弾 大丸梅田店 最終日",
  "kind": "千秋楽",
  "note": "大丸梅田1Fで買える最終日(20:00まで)",
  "reserved_on": "2026-10-09",
  "title": "SideM×大丸松坂屋コラボ第2弾",
  "url": "https://collabo-cafe.com/events/collabo/idolmaster-sidem-pop-up-store-daimaru-tokyo-umeda-2026/?amp=1",
  "source_type": "二次情報",
  "facts": [
   "企画名は「THE IDOLM@STER SideM × DAIMARU MATSUZAKAYA VOL.2」。",
   "大丸東京店: 2026年10月28日〜11月10日、3Fイベントスペース、営業時間10:00〜20:00。",
   "大丸梅田店: 2026年11月18日〜11月24日、1Fイベントスペース、営業時間10:00〜20:00。",
   "描き下ろしビジュアルのアパレルや雑貨が展開される。",
   "チャーム付きトートバッグは13,200円（税込）。",
   "キルティングポーチ（Black/White）は4,400円（税込）。",
   "キルティングIDケース（Black/White）は5,500円（税込）。",
   "スカーフ（全6種）は4,400円（税込）。",
   "アクリルスタンド（全6種）は2,200円（税込）。",
   "アクリルブロック（全7種）は3,630円（税込）。",
   "ポストカードセットは1,540円（税込）。",
   "ステッカーセットは1,650円（税込）。",
   "アクリルキーホルダー（12種）は880円（税込）。",
   "缶バッジ（12種）は660円（税込）。",
   "アクリルキーホルダーと缶バッジはコンプリートセットも販売される。",
   "描き下ろしビジュアルの衣装をモチーフにしたビジューやリボンなどのオリジナルパーツとイニシャルパーツを組み合わせて、バッグチャームを作れる企画がある。",
   "秋赤音さんが本企画の衣装を纏ったアイドルたちを特別に描き起こしている。",
   "ポップアップショップとオンライン受注販売で税込3,300円以上購入するごとに、オリジナルクリアカード（全6種）が1枚もらえる。",
   "クリアカードの絵柄は選べず、ポップアップショップでの特典はなくなり次第終了。",
   "混雑時は入場制限や入場整理券の配布を行う場合がある。",
   "一部商品はオンラインで受注販売予定。",
   "掲載商品は数量限定で、売り切れの場合がある。",
   "写真は製作中のもので、販売商品は予告なく変更される場合がある。",
   "エンゲージメント: 中"
  ],
  "via": "explore",
  "verify": "unconfirmed",
  "event_date": "2026-10-28",
  "deadline": "2026-11-24",
  "src_candidate_id": "202610081233-explore-5",
  "companion_of": "sched-2026-11-24-sidem-daimaru-vol2-2026-千秋楽",
  "src_dedup_key": "sidem-daimaru-matsuzakaya-vol-2-2026"
 },
 {
  "id": "sched-2026-11-24-sidem-daimaru-vol2-2026-千秋楽-src2",
  "dedup_key": "sidem-daimaru-vol2-2026",
  "brand": "sidem",
  "subject": "SideM×大丸松坂屋 第2弾 大丸梅田店 最終日",
  "kind": "千秋楽",
  "note": "大丸梅田1Fで買える最終日(20:00まで)",
  "reserved_on": "2026-10-09",
  "title": "SideMと大丸松坂屋のポップアップショップ開催",
  "url": "https://x.com/imas_official/status/2107742991859552636",
  "source_type": "公式",
  "facts": [
   "「THE IDOLM@STER SideM × DAIMARU MATSUZAKAYA」ポップアップショップが開催される。",
   "開催店舗は大丸東京店と大丸梅田店。",
   "エンゲージメント: 中"
  ],
  "via": "grok",
  "verify": "confirmed",
  "src_candidate_id": "202610090223-grok-82",
  "companion_of": "sched-2026-11-24-sidem-daimaru-vol2-2026-千秋楽",
  "src_dedup_key": "sidem-daimaru-matsuzakaya-popup-2026"
 },
 {
  "id": "sched-2026-11-24-sidem-daimaru-matsuzakaya-popup-2026-終了",
  "dedup_key": "sidem-daimaru-matsuzakaya-popup-2026",
  "brand": "sidem",
  "subject": "SideM×大丸松坂屋 大丸梅田店ポップアップ最終日",
  "kind": "終了",
  "note": "大丸梅田店の会期最終日で、会場に行ける最後の日",
  "reserved_on": "2026-10-28",
  "occurs_on": "2026-11-24",
  "title": "SideM×大丸松坂屋ポップアップショップ開催",
  "url": "https://idolmaster-official.jp/news/01_20080",
  "source_type": "公式",
  "facts": [
   "THE IDOLM@STER SideM × DAIMARU MATSUZAKAYAポップアップショップ第2弾。",
   "大丸東京店会期: 2026年10月28日(水)～11月10日(火)。",
   "大丸東京店会場: 大丸東京店3階イベントスペース（東京都千代田区丸の内1-9-1）。営業時間10:00～20:00。",
   "大丸梅田店会期: 2026年11月18日(水)～11月24日(火)。",
   "大丸梅田店会場: 大丸梅田店1階イベントスペース（大阪府大阪市北区梅田3-1-1）。営業時間10:00～20:00。",
   "描き下ろしビジュアルを使用し、アイドルから着想したアパレルや雑貨などを展開。",
   "描き下ろし衣装モチーフのビジュー、リボン、イニシャルパーツで自分だけのバッグチャームを作るカスタムチャーム企画を実施。",
   "大丸東京店・大丸梅田店とのコラボレーション空間演出とフォトスポットを用意。",
   "イラストレーター秋赤音とのスペシャルコラボレーションを実施。",
   "事前整理券対象: 大丸東京店2026年10月28日(水)終日、10月31日(土)10:00～14:00、11月1日(日)10:00～14:00。",
   "事前整理券対象: 大丸梅田店2026年11月18日(水)終日、11月21日(土)10:00～14:00、11月22日(日)10:00～14:00。",
   "オンライン受注販売期間: 2026年11月27日(金)12:00～12月23日(水)23:59予定。",
   "オンライン受注販売商品のお届け時期: 2027年4月上旬頃より順次。",
   "在庫状況により一部商品には購入数制限を設ける可能性がある。",
   "エンゲージメント: 高"
  ],
  "via": "grok",
  "verify": "confirmed",
  "event_date": "2026-10-28",
  "deadline": "2026-11-24",
  "src_candidate_id": "sched-2026-10-28-sidem-daimaru-matsuzakaya-popup-2026-開幕-src1",
  "src_dedup_key": "sidem-daimaru-matsuzakaya-2026"
 },
 {
  "id": "sched-2026-11-24-sidem-daimaru-matsuzakaya-popup-2026-終了-src1",
  "dedup_key": "sidem-daimaru-matsuzakaya-popup-2026",
  "brand": "sidem",
  "subject": "SideM×大丸松坂屋 大丸梅田店ポップアップ最終日",
  "kind": "終了",
  "note": "大丸梅田店の会期最終日で、会場に行ける最後の日",
  "reserved_on": "2026-10-28",
  "occurs_on": "2026-11-24",
  "title": "大丸東京店・大丸梅田店 SideMポップアップショップ",
  "url": "https://caltla.com/blogs/news/sidem-daimaru-matsuzakaya_popup",
  "source_type": "当事者",
  "facts": [
   "大丸東京店の開催期間: 2026年10月28日（水）～11月10日（火）。会場は3階イベントスペース、営業時間は10:00～20:00。",
   "大丸梅田店の開催期間: 2026年11月18日（水）～11月24日（火）。会場は1階イベントスペース、営業時間は10:00～20:00。",
   "大丸東京店では10月28日（水）は終日、10月31日（土）と11月1日（日）は10:00～14:00に事前整理券を配布。",
   "大丸梅田店では11月18日（水）は終日、11月21日（土）と11月22日（日）は10:00～14:00に事前整理券を配布。",
   "事前申込は先着順。大丸東京店は来場日前日の17:00から受付開始予定。大丸梅田店は受付開始日時が決まり次第案内。",
   "整理券の申込URLはページと公式Xで案内予定。申込にはメールアドレスが必要で、送信後の返信メールに申込フォームが届く。",
   "整理券は本人以外の代理申込は無効。受付番号順に呼び出し、案内時間から30分を過ぎても戻らない場合はキャンセル。",
   "事前整理券の申込は1人1日1回。整理券1枚につき同行できるのは未就学児のみで、未就学児以外の同行者は入場できない。",
   "事前整理券を持っていても商品の購入は確約されず、商品は数量限定で入場時に完売している場合がある。商品の取り置きはしない。",
   "事前整理券の対象日以外も、混雑状況に応じて店頭で整理券を配布する場合がある。整理券の配布状況や入場方法は変更される場合がある。",
   "オンライン受注販売の販売期間: 2026年10月28日（水）12:00～12月3日（木）11:59。",
   "オンライン受注商品の発送は2月下旬頃より順次予定。注文状況や生産状況によりお届け時期が前後する場合がある。",
   "ASOBI STOREでの事後通販も予定。",
   "同一商品は1人3点まで、トレーディング商品は1人12点まで購入可能。",
   "ポップアップショップの特典は数がなくなり次第終了。不良品以外の返品・交換は不可。",
   "エンゲージメント: 中"
  ],
  "via": "explore",
  "verify": "confirmed",
  "event_date": "2026-10-28",
  "deadline": "2026-12-03",
  "src_candidate_id": "sched-2026-10-28-sidem-daimaru-matsuzakaya-popup-2026-開幕",
  "companion_of": "sched-2026-11-24-sidem-daimaru-matsuzakaya-popup-2026-終了",
  "src_dedup_key": "sidem-daimaru-matsuzakaya-popup-2026"
 }
]
