[
 {
  "id": "sched-2027-05-07-sidem-11th-stage-live-bluray-締切前",
  "dedup_key": "sidem-11th-stage-live-bluray",
  "brand": "sidem",
  "subject": "SideM 11thライブBD受注",
  "kind": "締切前",
  "note": "受注締切(5/10)まもなく",
  "reserved_on": "2026-09-21",
  "title": "SideM 11th STAGE LIVE Blu-ray発売決定",
  "url": "https://shop.asobistore.jp/s/products/detail/249849-00-00-t_nml",
  "source_type": "準公式",
  "facts": [
   "販売価格: 26,400円(税込)",
   "発売日: 2027年7月14日(水)予定",
   "受注期間: 2027年5月10日(月)まで",
   "通常版はライブBlu-ray5枚組",
   "DISC1: DAY1本編①",
   "DISC2: DAY1本編②＋バックステージ（カメラ＆コメント映像）",
   "DISC3: DAY2本編①",
   "DISC4: DAY2本編②＋バックステージ（カメラ＆コメント映像）",
   "DISC5: Special Disc（撮り下ろし特典映像）",
   "特典映像として当日の出演キャストによるメッセージ＆バックステージ映像を収録予定",
   "9月19日(土)・9月20日(日)開催予定のオーディオコメンタリー付きアーカイブ同時視聴上映会の音声を一部編集してDISC1～DISC4に収録予定",
   "DAY1出演者: 山谷祥生（蒼井享介役）、渡辺紘（榊夏来役）、小林大紀（水嶋咲役）、中島ヨシキ（山下次郎役）、汐谷文康（北村想楽役）",
   "DAY2出演者: 高塚智人（渡辺みのり役）、中田祐矢（清澄九郎役）、児玉卓也（卯月巻緒役）、浦尾岳大（兜大吾役）、比留間俊哉（九十九一希役）、伊瀬結陸（天峰秀役）",
   "アソビストア購入特典: フォトフレーム入りカレンダー",
   "通常版のセット内容: 「THE IDOLM@STER SideM 11th STAGE ～EVER EVER＠FTER～」ライブBlu-ray5枚",
   "エンゲージメント: 高",
   "言及アイドル: 蒼井享介、榊夏来、水嶋咲、山下次郎、北村想楽、渡辺みのり、清澄九郎、卯月巻緒、兜大吾、九十九一希、天峰秀"
  ],
  "via": "explore",
  "verify": "confirmed",
  "src_candidate_id": "202609200734-explore-11",
  "event_date": "2027-07-14",
  "deadline": "2027-05-10"
 }
]
