[
 {
  "id": "sched-2027-03-31-tabiro-aichi-cg-collab-締切",
  "dedup_key": "tabiro-aichi-cg-collab",
  "brand": "cg",
  "subject": "『旅ろっ!愛知』×シンデレラガールズ コラボ",
  "kind": "締切",
  "note": "コラボ企画終了(あいちパックンチケット等)",
  "reserved_on": "2026-07-13",
  "facts": [
   "「旅ろっ！愛知」×「アイドルマスター シンデレラガールズ」コラボイベントの詳細情報を発表",
   "開催期間は2026年8月1日(土)～2027年3月31日(水)",
   "愛知県内で使える「あいちパックンチケット」販売、対象商品購入・体験でオリジナルコラボステッカー(全6種)配布などを実施",
   "特設サイトはhttps://aichi-platform.com/aichiticket-2026/",
   "エンゲージメント: 中",
   "2026-07-10にアイドルマスター公式(@imas_official)が詳細解禁を告知（いいね約1528・リポスト約1088）",
   "イベント名は「愛知・名古屋を食べ尽くそう！遊び尽くそう！」",
   "開催期間は2026-08-01(土)〜2027-03-31(水)",
   "あいちパックンチケット販売、全6種オリジナルコラボステッカー配布、コラボデザイン周遊観光パスポート販売などを実施",
   "特設サイト: https://aichi-platform.com/aichiticket-2026/",
   "エンゲージメント: 高",
   "2026-07-10 公式が「旅ろっ！愛知」×シンデレラガールズ コラボ『愛知・名古屋を食べ尽くそう！遊び尽くそう！』詳細を解禁",
   "開催期間：2026-08-01(土)〜2027-03-31(水)",
   "あいちパックンチケット販売、コラボステッカー全6種配布、平日用あいち･なごや周遊観光パスポート販売など",
   "特設サイト：https://aichi-platform.com/aichiticket-2026/",
   "公式X告知は約1,531いいね・約1,089RTと直近48時間で突出",
   "2026-07-10に「旅ろっ！愛知」×シンデレラガールズ「愛知・名古屋を食べ尽くそう！遊び尽くそう！」の詳細が解禁",
   "開催期間は2026-08-01〜2027-03-31",
   "あいちパックンチケット販売、コラボステッカー全6種配布、コラボ周遊観光パスポート販売などを実施",
   "公式X告知は約1531いいね・約1089RT"
  ],
  "title": "「旅ろっ！愛知」×シンデレラガールズ コラボ詳細解禁",
  "url": "https://idolmaster-official.jp/news/01_19336",
  "source_type": "公式",
  "via": "claude",
  "verify": "confirmed",
  "src_candidate_id": "202607120338-claude-6",
  "deadline": "2027-03-31"
 }
]
