[
 {
  "id": "sched-2026-07-27-tours-second-stage-illust-campaign-開幕",
  "dedup_key": "tours-second-stage-illust-campaign",
  "brand": "joint",
  "subject": "ツアマス Second Stage 1弾 カードイラストプレゼントCP",
  "kind": "開幕",
  "note": "TOURS Second Stage発表イベント&公開生配信(池袋サンシャインシティ)",
  "reserved_on": "2026-07-13",
  "facts": [
   "キャンペーン期間は2026年7月9日〜7月20日23:59",
   "公式X(@TOURS_imas)をフォローし、キャンペーン投稿をリポストまたは引用リポストすると、リプライでカードイラスト画像がランダムで1枚届く",
   "A賞は『アイドルマスター TOURS』描き下ろしカードイラスト画像8種からランダム1枚",
   "B賞は「えらべるPay」5,000円分を抽選で10名",
   "毎日1回まで繰り返し参加可能",
   "実施は株式会社バンダイナムコエクスペリエンス",
   "キャンペーン期間は2026年7月9日(木)〜7月20日(月)23:59",
   "公式X(@TOURS_imas)のフォロー&対象ポストのリポストまたは引用リポストで参加可能",
   "参加者にはリプライでカードイラスト画像8種からランダム1枚が届く(A賞)",
   "抽選で10名に「えらべるPay」5,000円分が当たる(B賞)",
   "1日1回まで繰り返し参加可能、実施はバンダイナムコエクスペリエンス",
   "『アイドルマスター TOURS』は765プロ・シンデレラガールズ・ミリオンライブ・シャニマス・SideM・学マス等、複数ブランドのアイドルが登場するブランド横断タイトル",
   "エンゲージメント: 中"
  ],
  "title": "アイドルマスター TOURS Second Stage 1弾 カードイラストプレゼントキャンペーン",
  "url": "https://bandainamco-am.co.jp/am/vg/idolmaster-tours/news/20260709.html",
  "source_type": "公式",
  "via": "",
  "verify": "confirmed",
  "src_candidate_id": "20260712-bnam-tours-illust-cp",
  "event_date": "2026-07-20"
 },
 {
  "id": "sched-2026-07-27-sidem-stage-costume-museum-千秋楽",
  "dedup_key": "sidem-stage-costume-museum",
  "brand": "sidem",
  "subject": "SideM STAGE COSTUME MUSEUM",
  "kind": "千秋楽",
  "note": "渋谷BEAMでの会期最終日",
  "reserved_on": "2026-07-13",
  "facts": [
   "「THE IDOLM@STER SideM STAGE COSTUME MUSEUM」が開催中",
   "2026年7月11日はDAY2で、当日券の販売はないと公式が案内"
  ],
  "title": "SideM STAGE COSTUME MUSEUM 開催中(7月11日はDAY2)",
  "url": "https://x.com/SideM_official/status/2075746897281847729",
  "source_type": "公式",
  "via": "",
  "verify": "unconfirmed",
  "src_candidate_id": "20260712-x-sidem-costume-museum",
  "event_date": "2026-07-11"
 },
 {
  "id": "sched-2026-07-27-million-14th-live-締切前",
  "dedup_key": "million-14th-live",
  "brand": "million",
  "subject": "ミリオン14thLIVE(9/19-20)とアソビストア先行",
  "kind": "締切前",
  "note": "先行申込締切(7/30 23:59)の3日前リマインド",
  "reserved_on": "2026-07-13",
  "facts": [
   "THE IDOLM@STER MILLION LIVE! 14thLIVEは2026年9月19日(土)・20日(日)開催",
   "アソビストア一般会員先行(抽選)の受付は2026年7月10日12:00〜7月30日23:59",
   "当落発表は2026年8月11日13:00から、入金期間は8月11日13:00〜8月15日23:59",
   "枚数制限は1人1公演につき2枚まで(複数公演申込可)、デジタルチケットのみ",
   "DAY1の公演名は「夢咲くワンダーミラージュ」",
   "未就学児入場不可、会場で本人確認を行う場合あり",
   "案内では全席でスタンディングでの観覧が可能とされている",
   "ポータル掲出は2026年7月10日付"
  ],
  "title": "ミリオン14thLIVE アソビストア一般会員先行 受付開始",
  "url": "https://idolmaster-official.jp/news/01_19351",
  "source_type": "公式",
  "via": "",
  "verify": "confirmed",
  "src_candidate_id": "20260712-portal-ml14th-senko",
  "event_date": "2026-09-19"
 },
 {
  "id": "sched-2026-07-27-tours-second-stage-launch-2026-開幕",
  "dedup_key": "tours-second-stage-launch-2026",
  "brand": "joint",
  "subject": "『アイマスTOURS』新シリーズ「Second Stage」始動",
  "kind": "開幕",
  "note": "新シリーズ発表イベント",
  "reserved_on": "2026-07-15",
  "facts": [
   "池袋・サンシャインシティ噴水広場で発表イベントを開催、新シリーズ「Second Stage」の詳細を発表予定",
   "ゲストは中村繪里子・峯田茉優・小鹿なお・千春の4名、YouTube生配信あり"
  ],
  "title": "『アイマスTOURS』新シリーズ発表イベント",
  "url": "https://idolmaster-official.jp/news/01_19284",
  "source_type": "公式",
  "verify": "confirmed",
  "src_candidate_id": "202607141242-claude-105",
  "event_date": "2026-07-27"
 },
 {
  "id": "sched-2026-07-27-cg-derepa-guest-schedule-2026-07-締切",
  "dedup_key": "cg-derepa-guest-schedule-2026-07",
  "brand": "cg",
  "subject": "デレパ ゲストメール受付(相葉夕美役・木村珠莉)",
  "kind": "締切",
  "note": "8/5放送分ゲストメール受付締切",
  "reserved_on": "2026-07-16",
  "facts": [
   "8月5日は相葉夕美役・木村珠莉さんがゲスト、メール受付は7月27日まで"
  ],
  "title": "デレパ 河瀬茉希ゲスト回と今後ゲスト予定",
  "url": "https://x.com/dereparty/status/2077385192680149070",
  "source_type": "公式",
  "verify": "confirmed",
  "src_candidate_id": "202607152347-grok-10",
  "event_date": "2026-07-27"
 }
]
