[
 {
  "id": "sched-2026-07-23-imas-taiwan-manga-expo-2026-開幕",
  "dedup_key": "imas-taiwan-manga-expo-2026",
  "brand": "general",
  "subject": "アイマス、台湾「第25回漫画博覧会」参加",
  "kind": "開幕",
  "note": "キャストステージ実施",
  "reserved_on": "2026-07-13",
  "facts": [
   "台北世界貿易センター1館で開催の「第25回漫画博覧会」にアイドルマスターシリーズとして参加決定",
   "特設ステージ「アイマス、アイに行きマス！in 台湾漫画博覧会」を2026年7月23日(木)14:30開場/15:00開演で実施",
   "出演は山根綺(緋田美琴役)と川口莉奈(斑鳩ルカ役)、共にシャイニーカラーズキャスト",
   "会場物販は同時期にアトレ川崎で開催のポップアップストア「Starlight Dining」と同一商品を予定",
   "エンゲージメント: 低",
   "言及アイドル: 緋田美琴、斑鳩ルカ",
   "『アイドルマスター』シリーズが台湾「第25回漫画博覧会」(2026年7月23日～27日、台北世界貿易中心一館)に参加",
   "キャストステージ「アイマス、アイに行きマス！in 台湾漫画博覧会」を2026年7月23日14:30開場/15:00開演で実施",
   "出演は『アイドルマスター シャイニーカラーズ』の山根綺(緋田美琴役)・川口莉奈(斑鳩琉花役)",
   "エンゲージメント: 中",
   "言及アイドル: 緋田美琴、斑鳩琉花"
  ],
  "title": "『アイドルマスター』シリーズ、台湾「第25回漫画博覧会」参加決定",
  "url": "https://idolmaster-official.jp/news/01_19042",
  "source_type": "公式",
  "via": "claude",
  "verify": "confirmed",
  "src_candidate_id": "202607130340-claude-121",
  "event_date": "2026-07-23"
 },
 {
  "id": "sched-2026-07-23-cg-memorial-picture-september-2026-締切前",
  "dedup_key": "cg-memorial-picture-september-2026",
  "brand": "cg",
  "subject": "メモリアルピクチャー4th Pict. September",
  "kind": "締切前",
  "note": "受注締切(7/26)の3日前リマインド",
  "reserved_on": "2026-07-13",
  "facts": [
   "ブランド公式が2026年7月12日に告知",
   "対象は輿水幸子／横山千佳",
   "受注締切は2026年7月26日(日)",
   "販売ページ: shop.asobistore.jp/feature/cg_mp",
   "ハッシュタグ #メモピク",
   "エンゲージメント: 中",
   "言及アイドル: 輿水幸子、横山千佳"
  ],
  "title": "メモリアルピクチャー 4th Pict. September受注告知",
  "url": "https://x.com/imas_CGofficial/status/2076214980391673962",
  "source_type": "公式",
  "via": "grok",
  "verify": "confirmed",
  "src_candidate_id": "202607130340-grok-10",
  "deadline": "2026-07-26"
 }
]
