[
 {
  "id": "sched-2027-02-27-cg-million-coming-soon-2026-08-26-開幕",
  "dedup_key": "cg-million-coming-soon-2026-08-26",
  "brand": "joint",
  "subject": "THE IDOLM@STER CINDERELLA GIRLS × MILLION LIVE! CLASH M@TCH!!",
  "kind": "開幕",
  "note": "DAY1開幕",
  "reserved_on": "2026-08-27",
  "title": "THE IDOLM@STER CINDERELLA GIRLS × MILLION LIVE! CLASH M@TCH!!",
  "url": "https://idolmaster-official.jp/news/01_19720",
  "source_type": "公式",
  "facts": [
   "2027年2月27日(土)・28日(日)に愛知県IGアリーナで開催、開場15:30・開演17:00(各日)",
   "アソビストアプレミアム会員最速先行(抽選)の申し込み期間：2026年8月26日(水)12:00〜2026年9月13日(日)23:59",
   "当落発表：2026年9月30日(水)13:00〜、入金期間：2026年9月30日(水)13:00〜2026年10月4日(日)23:59",
   "チケット料金（各日）：アリーナ前方席30,000円、プレミアムラウンジ付指定席20,000円、一般指定席15,000円（税込）"
  ],
  "via": "claude",
  "verify": "confirmed",
  "src_candidate_id": "202608261235-watch-0",
  "event_date": "2027-02-27"
 },
 {
  "id": "sched-2027-02-27-cg-million-coming-soon-2026-08-26-開幕-src1",
  "dedup_key": "cg-million-coming-soon-2026-08-26",
  "brand": "joint",
  "subject": "THE IDOLM@STER CINDERELLA GIRLS × MILLION LIVE! CLASH M@TCH!!",
  "kind": "開幕",
  "note": "DAY1開幕",
  "reserved_on": "2026-08-27",
  "title": "デレミリ合同ライブCLASH M@TCH!!が2027年2月IGアリーナで開催",
  "url": "https://x.com/imas_official/status/2092451730768429414",
  "source_type": "公式",
  "facts": [
   "2027年2月愛知県・IGアリーナにて「THE IDOLM@STER CINDERELLA GIRLS × MILLION LIVE! CLASH M@TCH!!」開催決定",
   "本日よりアソビストアプレミアム会員先行スタート",
   "詳細URL: https://idolmaster-official.jp/news/01_19720",
   "ハッシュタグは#デレミリ合同ライブ",
   "エンゲージメント: 高",
   "2027年2月愛知県・IGアリーナにてTHE IDOLM@STER CINDERELLA GIRLS × MILLION LIVE! CLASH M@TCH!!開催決定",
   "公式ニュース: https://idolmaster-official.jp/news/01_19720"
  ],
  "via": "grok",
  "verify": "confirmed",
  "event_date": "2027-02-27",
  "src_candidate_id": "202608270220-grok-102",
  "companion_of": "sched-2027-02-27-cg-million-coming-soon-2026-08-26-開幕",
  "src_dedup_key": "joint-cg-million-clash-match-2027-02"
 },
 {
  "id": "sched-2027-02-27-cg-million-coming-soon-2026-08-26-開幕-src2",
  "dedup_key": "cg-million-coming-soon-2026-08-26",
  "brand": "joint",
  "subject": "THE IDOLM@STER CINDERELLA GIRLS × MILLION LIVE! CLASH M@TCH!!",
  "kind": "開幕",
  "note": "DAY1開幕",
  "reserved_on": "2026-08-27",
  "title": "CLASH M@TCH!!は2027/2/27-28、IGアリーナで開催",
  "url": "https://x.com/imasml_765PRO/status/2092450055303438635",
  "source_type": "公式",
  "facts": [
   "THE IDOLM@STER CINDERELLA GIRLS × MILLION LIVE! CLASH M@TCH!! 開催決定",
   "2027/2/27(土) - 28(日)",
   "IGアリーナ",
   "YouTube: https://www.youtube.com/watch?v=wgCWiC2SQPw",
   "公式サイト: https://idolmaster-official.jp/live_event/deremilli_clashmatch/",
   "エンゲージメント: 高",
   "会場: IGアリーナ",
   "告知映像: https://www.youtube.com/watch?v=wgCWiC2SQPw"
  ],
  "via": "grok",
  "verify": "confirmed",
  "event_date": "2027-02-27",
  "src_candidate_id": "202608270220-grok-103",
  "companion_of": "sched-2027-02-27-cg-million-coming-soon-2026-08-26-開幕",
  "src_dedup_key": "joint-clash-match-dates-venue-2026-08-26"
 },
 {
  "id": "sched-2027-02-27-cg-million-coming-soon-2026-08-26-開幕-src3",
  "dedup_key": "cg-million-coming-soon-2026-08-26",
  "brand": "joint",
  "subject": "THE IDOLM@STER CINDERELLA GIRLS × MILLION LIVE! CLASH M@TCH!!",
  "kind": "開幕",
  "note": "DAY1開幕",
  "reserved_on": "2026-08-27",
  "title": "CLASH M@TCH!!にCINDERELLA BANDとMILLION STRINGSの出演が決定",
  "url": "https://x.com/imasml_765PRO/status/2092450603603742972",
  "source_type": "公式",
  "facts": [
   "#デレミリ合同ライブ 出演者情報",
   "DAY1・DAY2の出演キャストはこちら",
   "さらに「CINDERELLA BAND」＆「MILLION STRINGS」の出演も決定",
   "公式サイト: https://idolmaster-official.jp/live_event/deremilli_clashmatch/",
   "エンゲージメント: 高",
   "DAY1・DAY2の出演キャストを公開",
   "さらにCINDERELLA BAND＆MILLION STRINGSの出演も決定"
  ],
  "via": "grok",
  "verify": "confirmed",
  "event_date": "2027-02-27",
  "src_candidate_id": "202608270220-grok-104",
  "companion_of": "sched-2027-02-27-cg-million-coming-soon-2026-08-26-開幕",
  "src_dedup_key": "joint-clash-match-cast-band-strings-2026-08-26"
 },
 {
  "id": "sched-2027-02-27-cg-million-coming-soon-2026-08-26-開幕-src4",
  "dedup_key": "cg-million-coming-soon-2026-08-26",
  "brand": "joint",
  "subject": "THE IDOLM@STER CINDERELLA GIRLS × MILLION LIVE! CLASH M@TCH!!",
  "kind": "開幕",
  "note": "DAY1開幕",
  "reserved_on": "2026-08-27",
  "title": "CLASH M@TCH!!アソビストアプレミアム会員最速先行、受付は9/13まで",
  "url": "https://x.com/imasml_765PRO/status/2092451111819260169",
  "source_type": "公式",
  "facts": [
   "#デレミリ合同ライブ チケット情報",
   "本日よりアソビストアプレミアム会員最速先行がスタート",
   "受付期間 ～9/13(日)まで",
   "お申し込み: https://asobiticket2.asobistore.jp/receptions/2ef26712-5a2d-4458-bd90-8ed878126d87",
   "エンゲージメント: 中"
  ],
  "via": "grok",
  "verify": "confirmed",
  "deadline": "2026-09-13",
  "src_candidate_id": "202608270220-grok-105",
  "companion_of": "sched-2027-02-27-cg-million-coming-soon-2026-08-26-開幕",
  "src_dedup_key": "joint-clash-match-premium-preorder-2026-08-26"
 },
 {
  "id": "sched-2027-02-27-gaku-battlespirits-collab-booster-2027-発売",
  "dedup_key": "gaku-battlespirits-collab-booster-2027",
  "brand": "gaku",
  "subject": "バトスピ コラボブースター「学園アイドルマスター 輝けるアイドル」発売",
  "kind": "発売",
  "note": "店頭・通販で16パック入りBOXの発売を確認できる",
  "reserved_on": "2026-10-23",
  "occurs_on": "2027-02-27",
  "title": "バトルスピリッツ 学園アイドルマスター コラボブースター予約",
  "url": "https://www.amazon.co.jp/BANDAI-%E3%83%90%E3%83%88%E3%83%AB%E3%82%B9%E3%83%94%E3%83%AA%E3%83%83%E3%83%84-%E3%82%B3%E3%83%A9%E3%83%9C%E3%83%96%E3%83%BC%E3%82%B9%E3%82%BF%E3%83%BC-%E5%AD%A6%E5%9C%92%E3%82%A2%E3%82%A4%E3%83%89%E3%83%AB%E3%83%9E%E3%82%B9%E3%82%BF%E3%83%BC-%E8%BC%9D%E3%81%91%E3%82%8B%E3%82%A2%E3%82%A4%E3%83%89%E3%83%AB%E3%80%9026RCB03%E3%80%91/dp/B0HN6T84GW",
  "source_type": "当事者",
  "facts": [
   "商品名: バンダイ(BANDAI) バトルスピリッツ コラボブースター 学園アイドルマスター 輝けるアイドル【26RCB03】 (BOX)",
   "セット内容: 16パック入り",
   "価格: 5,808円（税込）",
   "発売予定日: 2027年2月27日",
   "予約受付中",
   "エンゲージメント: 中"
  ],
  "via": "grok",
  "verify": "confirmed",
  "link_from": "https://x.com/202407hajimeru/status/2113303365387993396",
  "src_candidate_id": "202610230227-grok-43"
 }
]
