[
 {
  "id": "sched-2026-07-30-million-14th-live-締切",
  "dedup_key": "million-14th-live",
  "brand": "million",
  "subject": "ミリオン14thLIVE(9/19-20)とアソビストア先行",
  "kind": "締切",
  "note": "アソビストア一般会員先行 申込締切",
  "reserved_on": "2026-07-13",
  "facts": [
   "THE IDOLM@STER MILLION LIVE! 14thLIVEは2026年9月19日(土)・20日(日)開催",
   "アソビストア一般会員先行(抽選)の受付は2026年7月10日12:00〜7月30日23:59",
   "当落発表は2026年8月11日13:00から、入金期間は8月11日13:00〜8月15日23:59",
   "枚数制限は1人1公演につき2枚まで(複数公演申込可)、デジタルチケットのみ",
   "DAY1の公演名は「夢咲くワンダーミラージュ」",
   "未就学児入場不可、会場で本人確認を行う場合あり",
   "案内では全席でスタンディングでの観覧が可能とされている",
   "ポータル掲出は2026年7月10日付"
  ],
  "title": "ミリオン14thLIVE アソビストア一般会員先行 受付開始",
  "url": "https://idolmaster-official.jp/news/01_19351",
  "source_type": "公式",
  "via": "",
  "verify": "confirmed",
  "src_candidate_id": "20260712-portal-ml14th-senko",
  "event_date": "2026-09-19"
 },
 {
  "id": "sched-2026-07-30-tokoname-maekawa-miku-manhole-anniversary-2026-発売",
  "dedup_key": "tokoname-maekawa-miku-manhole-anniversary-2026",
  "brand": "cg",
  "subject": "常滑「前川みく」マンホール1周年 第2弾グッズ発売",
  "kind": "発売",
  "note": "1周年当日・グッズ発売開始",
  "reserved_on": "2026-07-14",
  "facts": [
   "「前川みく」マンホールは2025年7月30日設置、2026年7月30日で設置1周年",
   "第2弾グッズ(ピンズ・アクリルコースター・マグネット)を2026年7月30日午前9時よりとこなめ観光案内所で発売開始"
  ],
  "title": "常滑「前川みく」マンホール1周年、第2弾グッズ",
  "url": "https://prtimes.jp/main/html/rd/p/000000088.000152789.html",
  "source_type": "当事者",
  "verify": "confirmed",
  "src_candidate_id": "202607130742-claude-115",
  "event_date": "2026-07-30"
 },
 {
  "id": "sched-2026-07-30-gakumas-sweets-paradise-deep-marine-2026-千秋楽",
  "dedup_key": "gakumas-sweets-paradise-deep-marine-2026",
  "brand": "gaku",
  "subject": "学マス×スイパラ コラボカフェ「Deep Marine Stage」",
  "kind": "千秋楽",
  "reserved_on": "2026-07-15",
  "facts": [
   "江ノ島海の家会場は7月1日〜7月30日開催、最終日30日は15時閉店予定"
  ],
  "title": "スイパラ「Deep Marine Stage」江ノ島会場閉幕",
  "url": "https://www.sweets-paradise.jp/collaboration/gakumasu4th",
  "source_type": "当事者",
  "verify": "confirmed",
  "src_candidate_id": "202607140744-grok-49",
  "event_date": "2026-07-30"
 },
 {
  "id": "sched-2026-07-30-shiny-summer-beach-box-2026-千秋楽",
  "dedup_key": "shiny-summer-beach-box-2026",
  "brand": "shiny",
  "subject": "シャニマスPE「サマー・ビーチ・ボックス」",
  "kind": "千秋楽",
  "reserved_on": "2026-07-15",
  "facts": [
   "プロデュースイベント「サマー・ビーチ・ボックス」は7月17日〜7月30日開催"
  ],
  "title": "シャニマスPE「サマー・ビーチ・ボックス」終了",
  "url": "https://x.com/imassc_official/status/2076909808977088828",
  "source_type": "公式",
  "verify": "confirmed",
  "src_candidate_id": "202607141843-grok-69",
  "event_date": "2026-07-30"
 },
 {
  "id": "sched-2026-07-30-shiny-yume-no-ato-saki-rerun-2026-千秋楽",
  "dedup_key": "shiny-yume-no-ato-saki-rerun-2026",
  "brand": "shiny",
  "subject": "シャニマス「夢のあと、さき」復刻",
  "kind": "千秋楽",
  "reserved_on": "2026-07-15",
  "facts": [
   "開催期間は7月17日〜7月30日11:59(予定)"
  ],
  "title": "シャニマス「夢のあと、さき」復刻終了",
  "url": "https://x.com/imassc_official/status/2076910060689654119",
  "source_type": "公式",
  "verify": "confirmed",
  "src_candidate_id": "202607141843-grok-71",
  "event_date": "2026-07-30"
 }
]
