[
 {
  "id": "sched-2026-09-06-cg-genka-yoenichi-popup-千秋楽",
  "dedup_key": "cg-genka-yoenichi-popup",
  "brand": "cg",
  "subject": "百鬼夜行POP UP『幻夏妖宴市』",
  "kind": "千秋楽",
  "note": "大阪会場 最終日",
  "reserved_on": "2026-07-13",
  "facts": [
   "百鬼夜行テーマのPOP UP SHOPを東京・大阪で開催",
   "東京は秋葉原館1Fで2026年8月1日〜8月16日、大阪は日本橋店1Fで8月21日〜9月6日",
   "妖怪に扮した鷺沢文香・依田芳乃・白坂小梅・藤原肇の描き下ろしとミニキャラが登場",
   "税込2,000円購入ごとにランダムでポストカード1枚の特典",
   "シンデレラガール総選挙2026の投票券に引き換え可能なシリアルコード付き商品の販売を予定",
   "ポータル掲出は2026年7月10日付",
   "2026-07-10に公式が百鬼夜行テーマPOP UP SHOP『幻夏妖宴市』の詳細を解禁（@imas_official いいね約688・リポスト約459）",
   "フィーチャーアイドルは鷺沢文香・依田芳乃・白坂小梅・藤原肇",
   "東京: 2026-08-01(土)〜08-16(日) 秋葉原館1F / 大阪: 2026-08-21(金)〜09-06(日) 日本橋店1F",
   "店内購入で総選挙投票券引換シリアルコード付き商品を予定",
   "購入特典は税込2,000円ごとランダムポストカード1枚（レシート合算不可・なくなり次第終了）",
   "エンゲージメント: 高",
   "言及アイドル: 鷺沢文香、依田芳乃、白坂小梅、藤原肇",
   "2026-07-10 公式ポータル／@imas_officialが百鬼夜行テーマPOP UP SHOP『幻夏妖宴市』の詳細を解禁",
   "描き下ろしは鷺沢文香・依田芳乃・白坂小梅・藤原肇",
   "東京：2026-08-01(土)〜08-16(日) 秋葉原館1F",
   "大阪：2026-08-21(金)〜09-06(日) 日本橋店1F",
   "対象商品税込2,000円ごとランダムポストカード1枚（合算不可・なくなり次第終了）",
   "店内購入に総選挙投票券引換可能なシリアルコード付帯予定"
  ],
  "title": "シンデレラ POP UP SHOP『幻夏妖宴市』詳細解禁",
  "url": "https://idolmaster-official.jp/news/01_19347",
  "source_type": "公式",
  "via": "",
  "verify": "confirmed",
  "src_candidate_id": "20260712-portal-cg-genka",
  "event_date": "2026-08-01"
 },
 {
  "id": "sched-2026-09-06-gakuen-realescapegame-nagoya-2026-千秋楽",
  "dedup_key": "gakuen-realescapegame-nagoya-2026",
  "brand": "gaku",
  "subject": "リアル脱出ゲーム×学園アイドルマスター 名古屋公演千秋楽",
  "kind": "千秋楽",
  "note": "名古屋会場最終日",
  "reserved_on": "2026-07-14",
  "facts": [
   "名古屋会場は2026年7月16日〜9月6日開催"
  ],
  "title": "学マス脱出ゲーム、名古屋公演7/16開幕",
  "url": "https://realdgame.jp/s/gkmas/index01.html",
  "source_type": "当事者",
  "verify": "confirmed",
  "src_candidate_id": "202607140344-claude-101",
  "event_date": "2026-09-06"
 },
 {
  "id": "sched-2026-09-06-gaku-shirube-fukuoka-ticket-general-resale-2026-千秋楽",
  "dedup_key": "gaku-shirube-fukuoka-ticket-general-resale-2026",
  "brand": "gaku",
  "subject": "学マス標ツアー福岡公演",
  "kind": "千秋楽",
  "note": "福岡サンパレス DAY2",
  "reserved_on": "2026-08-25",
  "facts": [
   "学園アイドルマスター LIVE TOUR -標- 福岡公演は2026年9月5日(土)・6日(日)、福岡サンパレス ホテル＆ホールで開催",
   "9月6日(日)は開場15:30/開演16:30",
   "出演は花海咲季、月村手毬、藤田ことね、篠澤広、雨夜燕"
  ],
  "title": "標ツアー福岡公演の一般先着・リセール開始",
  "url": "https://idolmaster-official.jp/news/01_19655",
  "source_type": "公式",
  "verify": "confirmed",
  "src_candidate_id": "202608240750-grok-31",
  "event_date": "2026-09-06"
 },
 {
  "id": "sched-2026-09-06-sidem-11th-stage-ticket-2026-締切",
  "dedup_key": "sidem-11th-stage-ticket-2026",
  "brand": "sidem",
  "subject": "SideM 11th STAGE 公式リセール",
  "kind": "締切",
  "note": "公式リセール受付締切9:59",
  "reserved_on": "2026-08-25",
  "facts": [
   "THE IDOLM@STER SideM 11th STAGE ～EVER EVER＠FTER～の公式リセールは2026年8月22日(土)15:00～9月6日(日)9:59まで",
   "開催日程：2026年9月12日(土)・13日(日)、TOYOTA ARENA TOKYO"
  ],
  "title": "SideM 11th Stage 現地チケット一般販売開始",
  "url": "https://idolmaster-official.jp/news/01_19610",
  "source_type": "公式",
  "verify": "confirmed",
  "src_candidate_id": "202608240750-claude-53",
  "event_date": "2026-09-12",
  "deadline": "2026-09-06"
 },
 {
  "id": "sched-2026-09-06-dsva-situation-voice14-2026-締切",
  "dedup_key": "dsva-situation-voice14-2026",
  "brand": "dsva",
  "subject": "ヴイアラ シチュエーションボイス第14弾",
  "kind": "締切",
  "note": "販売終了",
  "reserved_on": "2026-08-27",
  "title": "ヴイアラシチュエーションボイス第14弾、販売は9/6 23:59まで",
  "url": "https://x.com/valiv_official/status/2092552640911786063",
  "source_type": "公式",
  "facts": [
   "シチュエーションボイス第十四弾発売中",
   "シチュエーションボイス2026 8月のテーマは「”絶対にゆずれない...！”」",
   "販売期間：〜9/6(日)23:59"
  ],
  "via": "claude",
  "verify": "confirmed",
  "src_candidate_id": "202608270220-grok-92",
  "deadline": "2026-09-06"
 }
]
