[
 {
  "id": "sched-2026-12-01-sidem-super-retrose-party-2026-終了",
  "dedup_key": "sidem-super-retrose-party-2026",
  "brand": "sidem",
  "subject": "西武園ゆうえんち×SideM「超!!レトローズパーティ」第2弾",
  "kind": "終了",
  "reserved_on": "2026-09-02",
  "title": "西武園ゆうえんち×SideM「超!!レトローズパーティ」開催決定",
  "url": "https://prtimes.jp/main/html/rd/p/000000975.000011571.html",
  "source_type": "当事者",
  "facts": [
   "西武園ゆうえんちと「アイドルマスター SideM」のコラボイベントは2026年10月30日(金)～12月1日(火)開催",
   "スタンプラリーカード・特典の受け取り場所は順次公開"
  ],
  "via": "explore",
  "verify": "confirmed",
  "event_date": "2026-12-01",
  "src_candidate_id": "202609012336-explore-13"
 },
 {
  "id": "sched-2026-12-01-sidem-mfes2026-ornament-acrylic-keyholder-発売",
  "dedup_key": "sidem-mfes2026-ornament-acrylic-keyholder",
  "brand": "sidem",
  "subject": "SideM Mフェス2026 オーナメント風アクリルキーホルダー／グリッターキャラバッジ",
  "kind": "発売",
  "note": "Mフェス2026のオーナメント風アクリルキーホルダー・グリッターキャラバッジが発売される",
  "reserved_on": "2026-09-20",
  "title": "Mフェス2026オーナメント風アクリルキーホルダー",
  "url": "https://j-hobby.net/mate/1676156.html",
  "source_type": "二次情報",
  "facts": [
   "商品名は「アイドルマスター SideM オーナメント風アクリルキーホルダーコレクション／Mフェス2026」です。",
   "A-BOX、B-BOX、C-BOX、D-BOXが掲載されています。",
   "メーカーはムービックです。",
   "発売時期: 2026年12月1日",
   "参考価格: 880円(税込)",
   "JANコード/予約コード: 4550621739606",
   "エンゲージメント: 低"
  ],
  "via": "explore",
  "verify": "unconfirmed",
  "src_candidate_id": "202609192336-explore-28"
 },
 {
  "id": "sched-2026-12-01-sidem-seibuen-retro-party-2026-千秋楽",
  "dedup_key": "sidem-seibuen-retro-party-2026",
  "brand": "sidem",
  "subject": "西武園ゆうえんち SideMコラボ 最終日",
  "kind": "千秋楽",
  "note": "コラボを楽しめる最終日",
  "reserved_on": "2026-10-09",
  "title": "SideM西武園ゆうえんちコラボイベント『超!!レトローズ🌹パーティ』詳細解禁",
  "url": "https://idolmaster-official.jp/news/01_20092",
  "source_type": "公式",
  "facts": [
   "開催期間：2026年10月30日(金)～12月1日(火)（一部休園日あり）",
   "開催場所：西武園ゆうえんち（埼玉県所沢市山口2964）",
   "スペシャルパーティ開催日：10月31日(土)、11月1日(日)、11月22日(日)",
   "スペシャルパーティ時間：18:00～19:00",
   "スペシャルパーティ場所：レッツゴー！レオランド特設ステージ",
   "参加券付き1日レヂャー切符：¥10,000円",
   "チケット販売開始：2026年10月12日12:00より先着順",
   "周遊型ラリーイベント料金：1,500円",
   "ラリーイベント特典：バラの香り付きメッセージポストカード",
   "コラボゲーム『超!!わなげ』料金：700円",
   "わなげ参加賞：カレーの香りがするカード",
   "わなげ成功賞：レトロ缶バッジ",
   "オリジナルグッズ購入制限：1会計につきランダム商品は各種16個まで、オープン商品は各種5個まで(BOXは2個まで)",
   "グッズ購入特典：税込3,000円ご購入毎にランダムでブロマイド1枚プレゼント",
   "1日レヂャー切符特典：DRAMATIC STARS、W、Café Parade、S.E.M、F-LAGSの各ユニットプリントブロマイドセット",
   "1日レヂャー切符料金：大人5,400円、中高生4,700円、小学生4,100円、未就学児2,400円",
   "1日レヂャー切符販売期間：2026年10月13日(火)17:00～",
   "期間限定コラボフード＆ドリンク販売場所：軽食・売店 ミルクホール、食堂車レストラン 黄昏号",
   "録り下ろしボイス対象者：天道輝、蒼井享介、神谷幸広、硲道夫、秋月涼の5人",
   "ボイス対象アトラクション：回転空中ブランコ、オクトパス・アドベンチャー、富士見天望塔",
   "ボイス切り替わり時刻：15:00頃",
   "スペシャルパーティ出演：10月31日(土) 菊池勇成、山谷祥生、伊東健人、中島ヨシキ",
   "スペシャルパーティ出演：11月1日(日) 仲村宗悟、三瓶由布子、浦尾岳大、比留間俊哉",
   "スペシャルパーティ出演：11月22日(日) 狩野翔、児玉卓也、小林大紀",
   "連動企画『お仕事してマス！スタンプラリー』で東京ジョイポリスと連動",
   "エンゲージメント: 高",
   "言及アイドル: 蒼井悠介、蒼井享介、硲道夫、山下次郎、天道輝、秋月涼、兜大吾、九十九一希、神谷幸広、卯月巻緒、水嶋咲"
  ],
  "via": "watch",
  "verify": "confirmed",
  "src_candidate_id": "202610081834-watch-1",
  "event_date": "2026-10-30",
  "deadline": "2026-12-01"
 },
 {
  "id": "sched-2026-12-01-sidem-seibuen-retro-rose-party-2026-千秋楽",
  "dedup_key": "sidem-seibuen-retro-rose-party-2026",
  "brand": "sidem",
  "subject": "西武園ゆうえんち SideMコラボ最終日",
  "kind": "千秋楽",
  "note": "開催期間の最終日で、ラリーイベントに参加できる最後の日",
  "reserved_on": "2026-10-12",
  "title": "西武園ゆうえんち「SideM 超!!レトローズパーティ」開催",
  "url": "https://prtimes.jp/main/html/rd/p/000000995.000011571.html",
  "source_type": "当事者",
  "facts": [
   "開催期間: 2026年10月30日（金）～12月1日（火）",
   "開催場所は西武園ゆうえんち。",
   "西武園ゆうえんちの所在地は埼玉県所沢市。",
   "期間中、DRAMATIC STARS、W、Café Parade、S.E.M、F-LAGSの5グループのアイドルたちと謎を解く周遊型ラリーイベントを実施する。",
   "期間中、西武園ゆうえんちならではの録り下ろしボイスが聞けるコラボアトラクションを実施する。",
   "トークショーイベント「超!!レトローズ“スペシャル”パーティ」の開催日: 2026年10月31日（土）、11月1日（日）、11月22日（日）",
   "トークショーイベント「超!!レトローズ“スペシャル”パーティ」の時間: 18:00～19:00",
   "トークショーイベント「超!!レトローズ“スペシャル”パーティ」の場所: レッツゴー！レオランド特設ステージ",
   "トークショーイベントの参加方法: 「イベント参加券付き1日レヂャー切符」を購入する。",
   "「イベント参加券付き1日レヂャー切符」の価格: 10,000円。",
   "「イベント参加券付き1日レヂャー切符」のセット内容: 入園、アトラクション乗り放題、オリジナル特典、イベント参加券。",
   "チケットの販売は2026年10月12日（月・祝）12:00より先着順。",
   "周遊型ラリーイベント名: 「想いは繋がる超ミッション!!閉ざされた箱の謎」",
   "周遊型ラリーイベントは園内のマップ、看板、装飾などからヒントを探し、アイドルたちとメッセージを重ねて謎を解く内容。",
   "周遊型ラリーイベントの謎を解いた参加者には、コラボ限定のメッセージポストカードをプレゼントする。",
   "周遊型ラリーイベントの販売場所: 「夕日の丘商店街 萬屋雑貨店」",
   "周遊型ラリーイベントの料金: 1,500円。",
   "周遊型ラリーイベントの特典: バラの香り付きメッセージポストカード。好きな柄を選べる。",
   "期間限定コラボフード＆ドリンクは「軽食・売店 ミルクホール」と「食堂車レストラン 黄昏号」で販売する。",
   "コラボフードにはカレーをメインにしたメニュー、バラをモチーフにしたデザート、各ユニットカラーに合わせた色のドリンクがある。",
   "コラボフード＆ドリンクの購入者特典は西武園ゆうえんちオリジナルコースター。ランダム配布で、柄は選べない。",
   "コラボゲーム名: 「超！！わなげ」",
   "「超！！わなげ」の場所: 西武園ゆうえんち 夕日の縁日通り。",
   "「超！！わなげ」の料金: 700円。",
   "「超！！わなげ」の景品は参加賞と成功賞の2種類で、どちらもここでしか手に入らないオリジナルデザイン。",
   "「超！！わなげ」の参加賞: カレーの香りがするカード。ランダム配布。",
   "「超！！わなげ」の成功賞: レトロ缶バッジ。",
   "描き下ろしイラストを使用したコラボオリジナルグッズをレッツゴー！バザールで販売する。",
   "グッズ購入特典: 会計3,000円ごとに特典ブロマイドを1枚プレゼント。ランダム配布で、柄は選べない。",
   "録り下ろしボイスの出演アイドル: 天道輝、蒼井享介、神谷幸広、硲道夫、秋月涼。",
   "録り下ろしボイスの対象アトラクション: 回転空中ブランコ、オクトパス・アドベンチャー、富士見天望塔。",
   "富士見天望塔では15:00頃よりボイスが切り替わる。混雑状況により切り替わり時刻が前後する場合がある。",
   "対象アトラクションは天候、メンテナンス、その他の理由で休止となる場合がある。",
   "「夕日の縁日通り」でも録り下ろしオリジナルボイスを楽しめる。",
   "「特典付き1日レヂャー切符」は西武園ゆうえんちの入園とアトラクション乗り放題のチケットに、各ユニットがプリントされたブロマイドセットが付く。",
   "「特典付き1日レヂャー切符」の料金: 大人5,400円、中高生4,700円、小学生4,100円、未就学児2,400円。料金は税込。",
   "未就学児料金は3歳から適用される。",
   "「特典付き1日レヂャー切符」の販売場所: 西武園ゆうえんちWebサイト、チケット窓口。",
   "販売期間: 2026年10月13日（火）17:00～",
   "特典受け渡し場所: チケット窓口、おみやげ 萬屋雑貨店。",
   "前売り券は西武園ゆうえんちWebサイトのみで取り扱う。",
   "「没入型ドラマティック・レストラン～豪華列車はミステリーを乗せて～」、「ふしぎ駄菓子屋銭天堂 ザ・リアル」、「夕日の丘商店街事件簿」は別途料金が必要。",
   "西武園ゆうえんちと東京ジョイポリスの連動企画として、スタンプラリー「お仕事してマス！スタンプラリー」を開催する。",
   "スタンプラリーの参加方法: どちらか一方の施設でスタンプラリーカードを受け取り、最初に訪れた施設で1つ目、後に訪れた施設で2つ目のスタンプを押してもらい、両施設のスタンプが揃ったカードを特典受け渡し場所へ持参する。",
   "スタンプラリー特典: 「アイドルマスター SideM」オリジナル特典（A5サイズイラストカード）。",
   "西武園ゆうえんちでのスタンプラリーカード受け取り場所と特典受け取り場所: 「夕日の丘商店街 おみやげ 萬屋雑貨店」と「レッツゴー！バザール」。",
   "営業時間: 10月30日（金）・31日（土）は10:00～17:00。",
   "11月1日（日）以降の営業時間は順次公開予定。",
   "内容は予告なく変更・中止となる場合がある。",
   "エンゲージメント: 高",
   "言及アイドル: 天道輝、蒼井享介、神谷幸広、硲道夫、秋月涼",
   "2026年10月30日（金）～12月1日（火）開催。",
   "会場は西武園ゆうえんち。",
   "会期中、DRAMATIC STARS、W、Café Parade、S.E.M、F-LAGSのアイドルたちと謎を解く周遊型ラリーと、録り下ろしボイスが聞けるコラボアトラクションを実施。",
   "「超!!レトローズ“スペシャル”パーティ」は2026年10月31日（土）、11月1日（日）、11月22日（日）の3日間開催。",
   "「超!!レトローズ“スペシャル”パーティ」の時間は18:00～19:00、会場はレッツゴー！レオランド特設ステージ。",
   "参加には「イベント参加券付き1日レヂャー切符」の購入が必要で、価格は10,000円。入園、アトラクション乗り放題、オリジナル特典、イベント参加券がセット。",
   "「イベント参加券付き1日レヂャー切符」は2026年10月12日（月・祝）12:00から先着順で販売。",
   "周遊型ラリーイベント名は「想いは繋がる超ミッション!!閉ざされた箱の謎」。謎を解いた人にコラボ限定のメッセージポストカードを贈呈し、好きな柄を選べる。",
   "周遊型ラリーの販売場所は「夕日の丘商店街 萬屋雑貨店」、料金は1,500円、特典はバラの香り付きメッセージポストカード。",
   "「軽食・売店 ミルクホール」と「食堂車レストラン 黄昏号」で、カレーをメインにしたフード、バラをモチーフにしたデザート、各ユニットカラーに合わせたドリンクを販売。購入者特典の西武園ゆうえんちオリジナルコースターはランダム配布で、選べない。",
   "「超！！わなげ」の料金は700円、場所は夕日の縁日通り。参加賞はカレーの香りがするカード（ランダム配布）、成功賞はレトロ缶バッジ。",
   "レッツゴー！バザールで、期間限定の描き下ろしイラストを使ったコラボオリジナルグッズを販売。会計3,000円ごとに特典ブロマイド1枚をプレゼントし、ランダム配布で選べない。",
   "一部アトラクションで、天道輝・蒼井享介・神谷幸広・硲道夫・秋月涼の録り下ろしボイスを放送し、夕日の縁日通りでも録り下ろしオリジナルボイスを楽しめる。",
   "ボイス対象アトラクションは回転空中ブランコ、オクトパス・アドベンチャー、富士見天望塔。富士見天望塔は15:00頃からボイスが切り替わり、時刻は混雑状況により前後する場合がある。各アトラクションは天候やメンテナンスなどで休止する場合がある。",
   "「特典付き 1日レヂャー切符」の料金は大人5,400円、中高生4,700円、小学生4,100円、未就学児2,400円。未就学児料金は3歳から適用。",
   "「特典付き 1日レヂャー切符」の特典はDRAMATIC STARS、W、Café Parade、S.E.M、F-LAGSの各ユニットがプリントされたブロマイドセット。販売場所は西武園ゆうえんちWebサイトとチケット窓口。",
   "特典付き 1日レヂャー切符の販売期間: 2026年10月13日（火）17:00～。特典受け渡し場所はチケット窓口とおみやげ 萬屋雑貨店。前売り券は西武園ゆうえんちWebサイトのみで取り扱う。",
   "「お仕事してマス！スタンプラリー」は西武園ゆうえんちと東京ジョイポリスの連動企画。いずれかの施設でカードを受け取り、最初の施設と次に訪れた施設の両方でスタンプを集め、カードを特典受け渡し場所に持参すると、SideMオリジナル特典（A5サイズイラストカード）を受け取れる。",
   "西武園ゆうえんちでのスタンプラリーカード受け取り場所および特典受け取り場所は「夕日の丘商店街 おみやげ 萬屋雑貨店」と「レッツゴー！バザール」。",
   "開催中の営業時間は10月30日（金）・31日（土）ともに10:00～17:00。11月1日（日）以降の営業時間は順次公開予定。"
  ],
  "via": "explore",
  "verify": "confirmed",
  "src_candidate_id": "sched-2026-10-12-sidem-seibuen-retro-rose-party-2026-発売",
  "event_date": "2026-10-30",
  "deadline": "2026-12-01"
 }
]
