[
 {
  "id": "sched-2026-10-07-gaku-gold-rush-vol7-2026-発売",
  "dedup_key": "gaku-gold-rush-vol7-2026",
  "brand": "gaku",
  "subject": "学マス漫画『GOLD RUSH』第7巻発売",
  "kind": "発売",
  "note": "通常版・特装版同時発売日",
  "reserved_on": "2026-08-24",
  "facts": [
   "『学園アイドルマスター GOLD RUSH』第7巻が10月7日(水)発売予定",
   "通常版880円(10%税込)、特装版2,970円(10%税込)",
   "特装版に有村麻央の歌う書き下ろし新曲「とめどなく」を収録したオリジナルCDが付属"
  ],
  "title": "『GOLD RUSH』第7巻が10/7発売",
  "url": "https://x.com/gkmas_official/status/2090729938269995505",
  "source_type": "公式",
  "verify": "confirmed",
  "src_candidate_id": "202608232010-grok-49",
  "event_date": "2026-10-07"
 },
 {
  "id": "sched-2026-10-07-shiny-ramen-8-collab-2026-開幕",
  "dedup_key": "shiny-ramen-8-collab-2026",
  "brand": "shiny",
  "subject": "シャニマス×８番らーめんコラボ",
  "kind": "開幕",
  "note": "コラボグッズ購入や対象店舗でのコラボ展開が始まる",
  "reserved_on": "2026-09-19",
  "title": "シャニマス『８番らーめんコラボ』開催決定",
  "url": "https://idolmaster-official.jp/news/01_19923",
  "source_type": "公式",
  "facts": [
   "アルストロメリアの大崎甘奈、大崎甜花の出身地、富山県を含む北陸地方を代表するラーメンチェーン『８番らーめん』とのコラボ開催決定",
   "らーめん屋で働いている様子をコンセプトにした描きおろしイラストを使用したグッズの販売",
   "限定コラボセットなどの展開を予定",
   "開催場所：富山県・岡山県の８番らーめん、金澤醤油豚骨８番らーめん",
   "開催期間：2026年10月7日(水)～11月8日(日)",
   "続報をお楽しみに！",
   "エンゲージメント: 中",
   "言及アイドル: 大崎甘奈、大崎甜花",
   "アルストロメリアの大崎甘奈、大崎甜花の出身地、富山県を含む北陸地方を代表するラーメンチェーン「８番らーめん」とのコラボの開催が決定",
   "らーめん屋で働いている様子をコンセプトにした描きおろしイラストを使用したグッズの販売を予定",
   "開催場所: 富山県・岡山県の８番らーめん",
   "開催場所: 金澤醤油豚骨８番らーめん"
  ],
  "via": "watch",
  "verify": "confirmed",
  "src_candidate_id": "202609181838-watch-9",
  "event_date": "2026-10-07",
  "deadline": "2026-11-08"
 },
 {
  "id": "sched-2026-10-07-shiny-hachiban-collab-2026-開始",
  "dedup_key": "shiny-hachiban-collab-2026",
  "brand": "shiny",
  "subject": "シャニマス×8番らーめんコラボ",
  "kind": "開始",
  "note": "対象40店舗でコラボメニュー・グッズ販売が始まる",
  "reserved_on": "2026-09-30",
  "title": "8番らーめんコラボ開催",
  "url": "https://idolmaster-official.jp/news/01_20022",
  "source_type": "公式",
  "facts": [
   "富山県の8番らーめん31店舗、岡山県の8番らーめん5店舗、金澤醤油豚骨8番らーめん4店舗でコラボを実施する。",
   "開催期間: 2026年10月7日（水）～11月8日（日）。",
   "描きおろしイラストを使用したグッズ販売と限定コラボセットを実施する。",
   "対象メニュー注文者にAセットは特典会員証カード全6種と特典ポストカード全6種、Bセットは特典ポストカード全6種をランダムで1枚プレゼントする。",
   "ミニキャラパネルを全店に展示する。",
   "一部店舗でアルストロメリアとコメティックの等身大パネルを展示する。",
   "グッズ販売店舗は8番らーめん6店舗、金澤醤油豚骨8番らーめん2店舗、AKIHABARAゲーマーズ本店。",
   "オープン商品は1会計につき各3個まで、トレーディング商品は1会計につき2セットまで購入可能。",
   "DMM通販の販売期間: 10月7日（水）12:00～11月8日（日）23:59まで。",
   "DMM通販の商品は2027年2月より順次発送予定。",
   "コラボ限定デザインの「8番箱らーめん」を数量限定でハチバンeSHOPにて販売する。",
   "エンゲージメント: 高"
  ],
  "via": "explore",
  "verify": "confirmed",
  "src_candidate_id": "202609290733-explore-3",
  "event_date": "2026-10-07",
  "deadline": "2026-11-08"
 },
 {
  "id": "sched-2026-10-07-x-com-28-開始",
  "dedup_key": "x-com-28",
  "brand": "gaku",
  "subject": "初星学園放送部10/7回(春咲暖ゲスト)",
  "kind": "開始",
  "note": "春咲暖さんゲスト出演の初星学園放送部を視聴できる",
  "reserved_on": "2026-10-01",
  "title": "初星学園放送部 10/7放送回ゲスト",
  "url": "https://x.com/gkmas_official/status/2105278990957293841",
  "source_type": "公式",
  "facts": [
   "投稿日時: 2026-09-30 21:50 JST（Wed, 30 Sep 2026 12:50:00 GMT）",
   "催しの日: 10/7(水)放送回（開始時刻の記載はこの投稿にはない）",
   "締切: 記載なし",
   "番組名: #初星学園放送部",
   "10/7(水)放送回のゲスト: 春咲暖 さん (秦谷 美鈴役)",
   "投稿フォーム: https://idolmaster-official.jp/gakuen/gakuenradio/contact/",
   "おたよりを募集",
   "ハッシュタグ: #学マス",
   "エンゲージメント: 中",
   "言及アイドル: 秦谷 美鈴"
  ],
  "via": "grok",
  "verify": "confirmed",
  "src_candidate_id": "202610010223-grok-47"
 },
 {
  "id": "sched-2026-10-07-shiny-hachiban-ramen-collab-2026-開幕",
  "dedup_key": "shiny-hachiban-ramen-collab-2026",
  "brand": "shiny",
  "subject": "シャニマス×8番らーめんコラボ",
  "kind": "開幕",
  "note": "対象店舗でコラボメニュー・グッズ販売が始まる",
  "reserved_on": "2026-10-01",
  "title": "8番らーめん×シャイニーカラーズコラボ",
  "url": "https://www.appbank.net/2026/09/29/casual-food/3116972.php",
  "source_type": "二次情報",
  "facts": [
   "開催期間: 2026年10月7日～11月8日",
   "富山県の8番らーめん31店舗、岡山県の8番らーめん5店舗、金澤醤油豚骨8番らーめん4店舗が対象となる",
   "アルストロメリアとコメティックのメンバーがコラボ限定衣装の描き下ろしイラストで登場する",
   "8番らーめんのAセットは税込2,310円で、8番セット（味噌）または唐麺・餃子セット、特典会員証カード、コラボメニュー特典ポストカードが付く",
   "金澤醤油豚骨8番らーめんのAセットは税込2,200円で、金澤醤油豚骨または8っちゃんそば、特典会員証カード、コラボメニュー特典ポストカードが付く",
   "8番らーめんのBセットは税込1,760円で、料理とコラボメニュー特典ポストカードが付く",
   "金澤醤油豚骨8番らーめんのBセットは税込1,650円で、料理とコラボメニュー特典ポストカードが付く",
   "特典会員証カードとコラボメニュー特典ポストカードは全6種で、ランダム提供となる",
   "コラボ限定衣装のアクリルスタンド、缶バッジ、クリアファイルなどを一部店舗で販売する",
   "オープン商品は1会計につき3個まで、トレーディング商品は1会計につき2セットまで購入できる",
   "全店舗にミニキャラパネルを各店舗1名ずつ展示する",
   "大崎甘奈、大崎甜花、桑山千雪、斑鳩ルカ、鈴木羽那、郁田はるきの等身大パネルを一部店舗に展示する"
  ],
  "via": "explore",
  "verify": "unconfirmed",
  "src_candidate_id": "202610010223-explore-3",
  "event_date": "2026-10-07",
  "deadline": "2026-11-08"
 },
 {
  "id": "sched-2026-10-07-arcade-tours-s2-live-2026-締切",
  "dedup_key": "arcade-tours-s2-live-2026",
  "brand": "joint",
  "subject": "ツアマスS2弾生配信、出演者と現地観覧を発表",
  "kind": "締切",
  "note": "現地観覧の先行抽選応募ができる最終日",
  "reserved_on": "2026-10-02",
  "title": "『ツアマス』S2弾ライブ配信「イベント情報公開」",
  "url": "https://bandainamco-am.co.jp/am/vg/idolmaster-tours/news/20261001.html",
  "source_type": "公式",
  "facts": [
   "ライブ配信日時: 2026年10月15日(水) 19:00～20:30(予定)",
   "アーカイブ期間: 2026年11月11日(水)～2026年12月13日(日)23:59(予定)",
   "出演: Chiharu(袖屋璃空の声優)、Tatsuya Aoki(MC)、Minoura(プロデューサー)",
   "内容: S2更新情報アナウンス",
   "現地ライブビューイング会場: namco TOKYO (東急歌舞伎町タワー3階、東京都新宿区)",
   "開場: 18:00、開演: 19:00(予定)",
   "入場: 無料(1飲料購入必須)",
   "先行抽選申込: 2026年10月7日(水)23:59まで",
   "当落発表: 2026年10月8日(予定)",
   "ライブビューイング先行抽選: 25名を抽選で選定、入金期間未記載",
   "エンゲージメント: 中",
   "言及アイドル: 袖屋璃空"
  ],
  "via": "watch",
  "verify": "unconfirmed",
  "src_candidate_id": "202610012336-watch-4",
  "event_date": "2026-10-15",
  "deadline": "2026-10-07"
 }
]
