[
 {
  "id": "sched-2027-02-14-cg-cinderella-marine-symphony-2027-その他",
  "dedup_key": "cg-cinderella-marine-symphony-2027",
  "brand": "cg",
  "subject": "Marine-Symphony Day2ステージ",
  "kind": "その他",
  "note": "Day2スペシャルステージが開催される(詳細は後日発表)",
  "reserved_on": "2026-09-26",
  "title": "Cinderella Marine-Symphony開催決定",
  "url": "https://idolmaster-official.jp/news/01_19985",
  "source_type": "公式",
  "facts": [
   "開催期間：2027年1月9日(土)～3月10日(水)",
   "開催場所：横浜・八景島シーパラダイス（〒236-0006 神奈川県横浜市金沢区八景島）",
   "期間中は様々なコラボ企画を予定",
   "キャスト陣が出演するスペシャルステージも予定",
   "Day1：2027年1月16日(土)",
   "Day2：2027年2月14日(日)",
   "スペシャルステージ詳細は後日発表予定",
   "エンゲージメント: 高"
  ],
  "via": "watch",
  "verify": "confirmed",
  "src_candidate_id": "202609251235-watch-0",
  "event_date": "2027-01-09",
  "deadline": "2027-03-10"
 },
 {
  "id": "sched-2027-02-14-cg-xr-live-apple-of-my-ai-2027-千秋楽",
  "dedup_key": "cg-xr-live-apple-of-my-ai-2027",
  "brand": "cg",
  "subject": "ATHOME xR LIVE「Apple of my アイ」(山形)",
  "kind": "千秋楽",
  "note": "山形公演千秋楽(2公演目 16:30開場/17:30開演)",
  "reserved_on": "2026-09-29",
  "title": "ATHOME xR LIVE Apple of my アイ開催決定",
  "url": "https://idolmaster-official.jp/news/01_20020",
  "source_type": "公式",
  "facts": [
   "開催場所: 山形県 やまぎん県民ホール",
   "開催日時: 2027年2月13日(土) 開場18:00 / 開演19:00",
   "開催日時: 2027年2月14日(日) 開場11:30 / 開演12:30（1公演目）",
   "開催日時: 2027年2月14日(日) 開場16:30 / 開演17:30（2公演目）",
   "出演: #UNICUS（辻野あかり/砂塚あきら/夢見りあむ）",
   "出演: スウィート・ソアー（佐久間まゆ/橘 ありす）",
   "チケット種類: 【スペシャル特典付き】現地+xRライブストリーミングセットチケット 3公演通し券 60,000円(税込)",
   "チケット種類: 【特典付き】現地+xRライブストリーミングセットチケット 3公演通しチケット 45,000円(税込)",
   "チケット種類: 現地チケット 3公演通しチケット 29,400円(税込)",
   "チケット種類: 【スペシャル特典付き】現地+xRライブストリーミングセットチケット 20,000円(税込)",
   "チケット種類: 【特典付き】現地+xRライブストリーミングセットチケット 15,000円(税込)",
   "チケット種類: 現地チケット 全席指定 9,800円(税込)",
   "アソビストアプレミアム会員最速先行 受付期間: 2026年9月28日(月)21:30～10月18日(日)23:59",
   "当落発表: 2026年10月31日(土)13:00～",
   "入金期間: 2026年10月31日(土)13:00～11月4日(水)23:59",
   "枚数制限: お一人様1公演につき2枚まで（複数公演申込可）",
   "特典内容: アイドル寄せ書きメッセージ入りアクリル色紙",
   "特典内容: りんごろうお見送りハイタッチ会",
   "特典内容: 終演後オーディオドラマ",
   "特典内容: 特典ブロマイド（りんごろう）",
   "エンゲージメント: 高",
   "言及アイドル: 辻野あかり、砂塚あきら、夢見りあむ、佐久間まゆ、橘 ありす"
  ],
  "via": "watch",
  "verify": "confirmed",
  "src_candidate_id": "202609282336-watch-0",
  "deadline": "2026-11-04"
 },
 {
  "id": "sched-2027-02-14-cg-athome-apple-of-my-ai-2026-千秋楽",
  "dedup_key": "cg-athome-apple-of-my-ai-2026",
  "brand": "cg",
  "subject": "ATHOME xR LIVE Apple of my アイ",
  "kind": "千秋楽",
  "note": "山形公演最終日、昼夜2公演を実施",
  "reserved_on": "2026-10-02",
  "title": "シンデレラガールズ山形バレンタインライブ「ATHOME xR LIVE Apple of my アイ」開催決定",
  "url": "https://idolmaster-official.jp/live_event/cg_apai/",
  "source_type": "公式",
  "facts": [
   "2027年2月13日(土)・14日(日)に「ATHOME xR LIVE Apple of my アイ」を開催する。",
   "2027年2月13日(土)は開場18:00／開演19:00。",
   "2027年2月14日(日)は開場11:30／開演12:30。",
   "2027年2月14日(日)は開場16:30／開演17:30。",
   "開催場所は山形県・やまぎん県民ホール。",
   "出演者は辻野あかり、砂塚あきら、夢見りあむ、佐久間まゆ、橘ありす。",
   "主催・企画は株式会社バンダイナムコエンターテインメント。",
   "制作は株式会社バンダイナムコミュージックライブ。",
   "【スペシャル特典付き】現地+xRライブストリーミングセットチケット3公演通しチケットは60,000円(税込)。",
   "同チケットには現地チケット3公演分、xRライブストリーミングチケット3公演分、アイドル寄せ書きメッセージ入りアクリル色紙3公演分、りんごろうお見送りハイタッチ会3公演分、終演後オーディオドラマ3公演分、特典ブロマイド（りんごろう）3公演分が含まれる。",
   "【特典付き】現地+xRライブストリーミングセットチケット3公演通しチケットは45,000円(税込)。",
   "同チケットには現地チケット3公演分、xRライブストリーミングチケット3公演分、特典ブロマイド（りんごろう）3公演分が含まれる。",
   "現地チケット3公演通しチケットは29,400円(税込)。",
   "【スペシャル特典付き】現地+xRライブストリーミングセットチケットは20,000円(税込)。",
   "【特典付き】現地+xRライブストリーミングセットチケットは15,000円(税込)。",
   "現地チケット全席指定は9,800円(税込)。",
   "アソビストアプレミアム会員先行の受付期間は2026年9月28日(月)21:30～10月18日(日)23:59。",
   "当落発表は2026年10月31日(土)13:00～。",
   "入金期間は2026年10月31日(土)13:00～11月4日(水)23:59。",
   "枚数制限はお一人様1公演につき2枚まで（複数公演申込可）。",
   "アソビストアプレミアム会員先行はアソビストアプレミアム12か月会員のみ申し込める。",
   "未就学児は入場できない。",
   "エンゲージメント: 中",
   "言及アイドル: 辻野あかり、砂塚あきら、夢見りあむ、佐久間まゆ、橘ありす"
  ],
  "via": "explore",
  "verify": "confirmed",
  "src_candidate_id": "202610010734-explore-19",
  "event_date": "2027-02-13",
  "deadline": "2026-10-18"
 },
 {
  "id": "sched-2027-02-14-cg-apple-of-my-ai-2027-千秋楽",
  "dedup_key": "cg-apple-of-my-ai-2027",
  "brand": "cg",
  "subject": "Apple of my アイ 公演最終日",
  "kind": "千秋楽",
  "note": "12:30と17:30開演の2公演を視聴できる",
  "reserved_on": "2026-10-18",
  "occurs_on": "2027-02-14",
  "title": "ATHOME xR LIVE Apple of my アイ",
  "url": "https://t.co/F4IcLM9ABj",
  "source_type": "公式",
  "facts": [
   "公演名はATHOME xR LIVE Apple of my アイ。",
   "開催場所は山形県 やまぎん県民ホール。",
   "2027年2月13日(土) 開場18:00 / 開演19:00。",
   "2027年2月14日(日) 開場11:30 / 開演12:30。",
   "2027年2月14日(日) 開場16:30 / 開演17:30。",
   "出演者は辻野あかり・砂塚あきら・夢見りあむ・佐久間まゆ・橘ありす。",
   "アソビストアプレミアム会員先行: 2026年9月28日(月)21:30～10月18日(日)23:59。",
   "当落発表: 2026年10月31日(土)13:00～。",
   "入金期間: 2026年10月31日(土)13:00～11月4日(水)23:59。",
   "枚数制限: お一人様1公演につき2枚まで（複数公演申込可）。",
   "先行申込条件はアソビストアプレミアム12か月会員。未就学児入場不可。",
   "全席指定現地チケットは9,800円(税込)。",
   "現地+xRライブストリーミングセットチケットは15,000円(税込)、特典付き3公演通しチケットは45,000円(税込)、スペシャル特典付き3公演通しチケットは60,000円(税込)。",
   "現地+xRライブストリーミングセットチケットは20,000円(税込)、スペシャル特典付き3公演通しチケットは60,000円(税込)。",
   "特典にはりんごろうのブロマイド、アイドル寄せ書きメッセージ入りアクリル色紙、りんごろうお見送りハイタッチ会、終演後オーディオドラマが含まれる券種がある。",
   "エンゲージメント: 高",
   "言及アイドル: 辻野あかり、砂塚あきら、夢見りあむ、佐久間まゆ、橘ありす"
  ],
  "via": "grok",
  "verify": "confirmed",
  "src_candidate_id": "sched-2026-10-18-cg-apple-of-my-ai-2027-締切",
  "event_date": "2027-02-13",
  "deadline": "2026-10-18"
 }
]
