[
 {
  "id": "sched-2026-12-19-shiny-stillblue-asobipremium-lottery-開幕",
  "dedup_key": "shiny-stillblue-asobipremium-lottery",
  "brand": "shiny",
  "subject": "shiny, the first REFRAC7IONS \"Still blue\"",
  "kind": "開幕",
  "note": "公演初日",
  "reserved_on": "2026-08-27",
  "title": "Still blue チケット一般会員先行販売開始",
  "url": "https://idolmaster-official.jp/live_event/REFRAC7IONS_Still_blue/ticket/",
  "source_type": "公式",
  "facts": [
   "アソビストア一般会員先行販売: 2026年8月27日(木)12:00開始、販売期間: 8月27日(木)12:00〜9月23日(水)23:59",
   "ライブ開催予定: 2026年12月19日(土)・20日(日) 国立代々木競技場 第一体育館",
   "当落発表は10月8日13時から、入金期間は同時刻から10月12日23:59まで"
  ],
  "via": "claude",
  "verify": "confirmed",
  "src_candidate_id": "202608270220-claude-147",
  "event_date": "2026-12-19"
 },
 {
  "id": "sched-2026-12-19-shiny-stillblue-asobipremium-lottery-開幕-src1",
  "dedup_key": "shiny-stillblue-asobipremium-lottery",
  "brand": "shiny",
  "subject": "shiny, the first REFRAC7IONS \"Still blue\"",
  "kind": "開幕",
  "note": "公演初日",
  "reserved_on": "2026-08-27",
  "title": "REFRAC7IONS一般会員先行が8/27 12:00開始予定",
  "url": "https://x.com/shinyc_official/status/2092221200181211561",
  "source_type": "公式",
  "facts": [
   "shiny, the first REFRAC7IONS \" Still blue \"",
   "8/27(木)12:00～ アソビストア一般会員先行が開始予定",
   "チケット詳細: https://idolmaster-official.jp/live_event/REFRAC7IONS_Still_blue/ticket/",
   "エンゲージメント: 高"
  ],
  "via": "grok",
  "verify": "confirmed",
  "event_date": "2026-08-27",
  "src_candidate_id": "202608270220-grok-44",
  "companion_of": "sched-2026-12-19-shiny-stillblue-asobipremium-lottery-開幕"
 },
 {
  "id": "sched-2026-12-19-refrac7ions-still-blue-2026-開幕",
  "dedup_key": "refrac7ions-still-blue-2026",
  "brand": "shiny",
  "subject": "Still blue公演DAY1",
  "kind": "開幕",
  "note": "公演DAY1が開演18:00",
  "reserved_on": "2026-09-18",
  "title": "shiny, the first REFRAC7IONS \"Still blue\" 公式グッズ事前販売ファイナル",
  "url": "https://idolmaster-official.jp/news/01_19914",
  "source_type": "公式",
  "facts": [
   "「shiny, the first REFRAC7IONS \" Still blue \"」公式グッズ事前販売ファイナルがスタート",
   "「PJ: REFRAC7IONS」各ユニットの描きおろしキービジュアルイラストをあしらったグッズや、7ユニットそれぞれをイメージしたグッズが登場",
   "一部アイテムは数量限定での販売",
   "カードフォリオ シャイニーカラーズver. vol.3受注中、受注期間: 2026年10月4日(日)まで",
   "「アイドルマスター カードフォリオ シャイニーカラーズ ver. vol.3」には、「PJ: REFRAC7IONS」のユニット衣装や、「My Songs Collection」「283Birthday Collection」のイラストが収録",
   "新規描きおろしイラストのMRは「PJ: REFRAC7IONS」衣装での自撮りショット",
   "協賛社グッズ販売もスタート、受注期間: 2026年10月4日(日)まで",
   "予定数に達した場合、ご注文の途中終了や発売日の変更を行う場合があります",
   "プロデュースポーチ各種は数量限定販売（ブラック/グレー各種）",
   "公演日程: 2026年12月19日(土) 17:00開場／18:00開演、2026年12月20日(日) 16:00開場／17:00開演",
   "会場: 国立代々木競技場 第一体育館",
   "エンゲージメント: 中",
   "言及アイドル: 黛 冬優子、園田智代子、鈴木羽那、七草にちか、大崎甜花、浅倉 透、幽谷霧子、八宮めぐる、市川雛菜、月岡恋鐘、小宮果穂、芹沢あさひ、樋口円香、緋田美琴、斑鳩ルカ、西城樹里、田中摩美々、郁田はるき、櫻木真乃、有栖川夏葉、和泉愛依、桑山千雪、風野灯織、白瀬咲耶、杜野凛世、大崎甘奈、福丸小糸、三峰結華"
  ],
  "via": "watch",
  "verify": "confirmed",
  "src_candidate_id": "202609171837-watch-5",
  "event_date": "2026-12-19",
  "deadline": "2026-10-04"
 },
 {
  "id": "sched-2026-12-19-shiny-fumage-cruise-2026-開幕",
  "dedup_key": "shiny-fumage-cruise-2026",
  "brand": "shiny",
  "subject": "シャニマス『Fumage』コラボクルーズ",
  "kind": "開幕",
  "note": "船上撮影会クルーズの初日(全3便)。当選者は乗船できる",
  "reserved_on": "2026-10-11",
  "title": "シャニマス『Fumage』コラボクルーズ ～船の上の撮影会～",
  "url": "https://idolmaster-official.jp/news/01_20083",
  "source_type": "公式",
  "facts": [
   "開催日程: 2026年12月19日(土)・20日(日) 各日1日3便（計6便）",
   "第1便目 9:00～10:00",
   "第2便目 11:00～12:00",
   "第3便目 13:00～14:00",
   "抽選申込期間: 2026年10月6日(火)～10月11日(日) 23:59まで",
   "通常プラン：15,600円（税込）",
   "【Fumage】等身アクスタ2種付きプラン＋4,600円",
   "【アンティーカ】アクスタ5種付きプラン＋4,500円",
   "【ノクチル】アクスタ4種付きプラン＋3,600円",
   "全オプション追加で28,300円のプランとなる",
   "オリジナルコラボドリンク（ランダムコースター付き）の販売",
   "エンゲージメント: 高",
   "言及アイドル: Fumage、アンティーカ、ノクチル",
   "開催日程: 2026年12月19日(土)・20日(日)、各日1日3便（計6便）。",
   "第1便目は9:00～10:00。",
   "第2便目は11:00～12:00。",
   "第3便目は13:00～14:00。",
   "抽選申込期間: 2026年10月6日(火)～10月11日(日) 23:59まで。",
   "通常プランは15,600円（税込）。",
   "通常プランに【Fumage】等身アクスタ2種付きプランを＋4,600円で追加できる（複数選択可）。",
   "通常プランに【アンティーカ】アクスタ5種付きプランを＋4,500円で追加できる（複数選択可）。",
   "通常プランに【ノクチル】アクスタ4種付きプランを＋3,600円で追加できる（複数選択可）。",
   "通常プランに全オプションを追加した場合は28,300円。",
   "オリジナルコラボドリンク（ランダムコースター付き）も販売される。",
   "オリジナルコラボドリンクは現地会場のみで販売され、支払いは現金のみ。",
   "Fumageの二人がクルーズ船で撮影する仕事に挑戦する企画。",
   "船内でFumageの録り下ろし船内アナウンスを放送する。",
   "船内モニターで公式MV等を上映する。",
   "船内をFumageのキャラパネルと、撮影会を応援に来たアンティーカ・ノクチルのメンバーの描き起こしちびキャラパネルで装飾する。",
   "全プランに、フォト風デザインの本企画限定「フォト風クルーズチケット」が付く。",
   "全プランにビュッフェまたはお弁当とソフトドリンク飲み放題が付く。",
   "グッズ付きプランでは、新規描き起こしのアンティーカ・ノクチルのちびキャラとFumageの等身イラストを使った特製アクリルスタンドが付く。",
   "エンゲージメント: 中",
   "2026年12月19日(土)・20日(日)に開催する。",
   "各日1日3便、計6便。",
   "第1便目 9:00～10:00。",
   "第2便目 11:00～12:00。",
   "第3便目 13:00～14:00。",
   "【Fumage】等身アクスタ2種付きプランは通常プランに4,600円追加。",
   "【アンティーカ】アクスタ5種付きプランは通常プランに4,500円追加。",
   "【ノクチル】アクスタ4種付きプランは通常プランに3,600円追加。",
   "上記オプションは複数選択可能。",
   "全オプション追加で28,300円のプランとなる。",
   "オリジナルコラボドリンク（ランダムコースター付き）は現地会場のみで販売し、支払いは現金のみ。"
  ],
  "via": "watch",
  "verify": "confirmed",
  "src_candidate_id": "sched-2026-10-11-shiny-fumage-cruise-2026-締切",
  "event_date": "2026-12-19",
  "deadline": "2026-10-11"
 }
]
