[
 {
  "id": "sched-2027-01-24-sidem-fantastic-battle-fes-2026-千秋楽",
  "dedup_key": "sidem-fantastic-battle-fes-2026",
  "brand": "sidem",
  "subject": "F@NTASTIC BATTLE FES ～Wanna step in～ 幕張公演",
  "kind": "千秋楽",
  "reserved_on": "2026-09-02",
  "title": "【SideMF@NFES】～Wanna step in～ 詳細発表！アイドル達の新ビジュアルも公開",
  "url": "https://idolmaster-official.jp/news/01_19739",
  "source_type": "公式",
  "facts": [
   "幕張公演日時: 2027年1月23日(土)昼公演10:30開場/11:30開演、夜公演16:00開場/17:00開演",
   "幕張公演日時: 2027年1月24日(日)昼公演10:30開場/11:30開演、夜公演16:00開場/17:00開演",
   "会場(幕張): 幕張イベントホール",
   "8公演それぞれセットリスト・MC・演出などの公演内容が一部異なる"
  ],
  "via": "watch",
  "verify": "confirmed",
  "event_date": "2027-01-24",
  "src_candidate_id": "202609012336-watch-1"
 },
 {
  "id": "sched-2027-01-24-kimchikura-anisama-seoul-2027-千秋楽",
  "dedup_key": "kimchikura-anisama-seoul-2027",
  "brand": "shiny",
  "subject": "KIMCHIKURA×ANISAMA SEOUL 2027 DAY2",
  "kind": "千秋楽",
  "note": "DAY2、シーズの出演を見に行ける(開場14:30・開演16:00)",
  "reserved_on": "2026-10-24",
  "occurs_on": "2027-01-24",
  "title": "KIMCHIKURA×ANISAMA SEOUL 2027 シャニマス出演",
  "url": "https://x.com/shinyc_official/status/2113595606359027846",
  "source_type": "公式",
  "facts": [
   "【お知らせ】",
   "KIMCHIKURA×ANISAMA SEOUL 2027",
   "＃シャニマス より",
   "DAY1 イルミネーションスターズ🌟",
   "DAY2 シーズ💎",
   "の出演が決定✨",
   "📅2027.01.23（土）– 01.24（日）",
   "📍Seoul, BLUESQUARE Woori WON Banking Hall",
   "ぜひチェックしてくださいね♪",
   "開催日: 2027年1月23日–24日",
   "会場: Seoul, BLUESQUARE Woori WON Banking Hall",
   "DAY1: イルミネーションスターズ",
   "DAY2: シーズ",
   "チケット販売スケジュールなど詳細は後日発表",
   "エンゲージメント: 中",
   "イベント名: KIMCHIKURA×ANISAMA SEOUL 2027",
   "DAY1の出演者: イルミネーションスターズ",
   "DAY2の出演者: シーズ",
   "開催日: 2027-01-23",
   "開催日: 2027-01-24",
   "エンゲージメント: 低"
  ],
  "via": "grok",
  "verify": "confirmed",
  "event_date": "2027-01-23",
  "src_candidate_id": "202610240226-grok-51"
 }
]
