[
 {
  "id": "sched-2026-12-20-shiny-stillblue-asobipremium-lottery-千秋楽",
  "dedup_key": "shiny-stillblue-asobipremium-lottery",
  "brand": "shiny",
  "subject": "shiny, the first REFRAC7IONS \"Still blue\"",
  "kind": "千秋楽",
  "note": "公演千秋楽",
  "reserved_on": "2026-08-27",
  "title": "Still blue チケット一般会員先行販売開始",
  "url": "https://idolmaster-official.jp/live_event/REFRAC7IONS_Still_blue/ticket/",
  "source_type": "公式",
  "facts": [
   "アソビストア一般会員先行販売: 2026年8月27日(木)12:00開始、販売期間: 8月27日(木)12:00〜9月23日(水)23:59",
   "ライブ開催予定: 2026年12月19日(土)・20日(日) 国立代々木競技場 第一体育館",
   "当落発表は10月8日13時から、入金期間は同時刻から10月12日23:59まで"
  ],
  "via": "claude",
  "verify": "confirmed",
  "src_candidate_id": "202608270220-claude-147",
  "event_date": "2026-12-20"
 },
 {
  "id": "sched-2026-12-20-kotobukiya-arcflags-popup-2026-終了",
  "dedup_key": "kotobukiya-arcflags-popup-2026",
  "brand": "million",
  "subject": "『ARC-FLAGS POP UP CORNER』コトブキヤ日本橋店",
  "kind": "終了",
  "reserved_on": "2026-09-03",
  "facts": [
   "コトブキヤ日本橋店での開催期間は12月4日〜20日"
  ],
  "title": "『ARC-FLAGS POP UP CORNER』コトブキヤで開催決定",
  "url": "https://idolmaster-official.jp/news/01_19737",
  "source_type": "公式",
  "verify": "confirmed",
  "src_candidate_id": "202609022336-watch-3",
  "event_date": "2026-12-20"
 },
 {
  "id": "sched-2026-12-20-refrac7ions-still-blue-2026-千秋楽",
  "dedup_key": "refrac7ions-still-blue-2026",
  "brand": "shiny",
  "subject": "Still blue公演DAY2(千秋楽)",
  "kind": "千秋楽",
  "note": "公演DAY2が開演17:00",
  "reserved_on": "2026-09-18",
  "title": "shiny, the first REFRAC7IONS \"Still blue\" 公式グッズ事前販売ファイナル",
  "url": "https://idolmaster-official.jp/news/01_19914",
  "source_type": "公式",
  "facts": [
   "「shiny, the first REFRAC7IONS \" Still blue \"」公式グッズ事前販売ファイナルがスタート",
   "「PJ: REFRAC7IONS」各ユニットの描きおろしキービジュアルイラストをあしらったグッズや、7ユニットそれぞれをイメージしたグッズが登場",
   "一部アイテムは数量限定での販売",
   "カードフォリオ シャイニーカラーズver. vol.3受注中、受注期間: 2026年10月4日(日)まで",
   "「アイドルマスター カードフォリオ シャイニーカラーズ ver. vol.3」には、「PJ: REFRAC7IONS」のユニット衣装や、「My Songs Collection」「283Birthday Collection」のイラストが収録",
   "新規描きおろしイラストのMRは「PJ: REFRAC7IONS」衣装での自撮りショット",
   "協賛社グッズ販売もスタート、受注期間: 2026年10月4日(日)まで",
   "予定数に達した場合、ご注文の途中終了や発売日の変更を行う場合があります",
   "プロデュースポーチ各種は数量限定販売（ブラック/グレー各種）",
   "公演日程: 2026年12月19日(土) 17:00開場／18:00開演、2026年12月20日(日) 16:00開場／17:00開演",
   "会場: 国立代々木競技場 第一体育館",
   "エンゲージメント: 中",
   "言及アイドル: 黛 冬優子、園田智代子、鈴木羽那、七草にちか、大崎甜花、浅倉 透、幽谷霧子、八宮めぐる、市川雛菜、月岡恋鐘、小宮果穂、芹沢あさひ、樋口円香、緋田美琴、斑鳩ルカ、西城樹里、田中摩美々、郁田はるき、櫻木真乃、有栖川夏葉、和泉愛依、桑山千雪、風野灯織、白瀬咲耶、杜野凛世、大崎甘奈、福丸小糸、三峰結華"
  ],
  "via": "watch",
  "verify": "confirmed",
  "src_candidate_id": "202609171837-watch-5",
  "event_date": "2026-12-19",
  "deadline": "2026-10-04"
 },
 {
  "id": "sched-2026-12-20-million-arc-flags-pop-up-corner-2026-千秋楽",
  "dedup_key": "million-arc-flags-pop-up-corner-2026",
  "brand": "million",
  "subject": "ARC-FLAGS POP UP CORNER コトブキヤ日本橋1F",
  "kind": "千秋楽",
  "note": "日本橋1Fの最終日で、この日まで立ち寄れる",
  "reserved_on": "2026-10-17",
  "occurs_on": "2026-12-20",
  "title": "ミリオン ARC-FLAGS POP UP CORNER グッズ",
  "url": "https://idolmaster-official.jp/news/01_20145",
  "source_type": "公式",
  "facts": [
   "「ARC-FLAGS POP UP CORNER」の詳細が解禁",
   "ミニキャライラスト公開",
   "アクアリウスのアイドルたちもミニキャラとして登場",
   "所恵美、舞浜歩、真壁瑞希の「サジタリアス」3人がかっこよく旗を掲げて玉座に座る姿",
   "購入特典: 開催期間中、対象商品を税込2,000円お買い上げごとにランダムでポストカードを1枚プレゼント",
   "購入特典: ※レシートの合算は出来かねます",
   "購入特典: ※特典はなくなり次第終了",
   "購入特典: ※ランダムでの お渡しの為、絵柄はお選びいただけません",
   "購入特典: ※通販は対象外",
   "開催場所・期間: コトブキヤ秋葉原館1F：11月6日（金）〜11月23日（月）",
   "開催場所・期間: コトブキヤ日本橋1F：12月4日（金）〜12月20日（日）",
   "詳細: 特設サイト https://www.kotobukiya.co.jp/event/detail/1357/",
   "エンゲージメント: 中",
   "言及アイドル: 所恵美、舞浜歩、真壁瑞希",
   "コトブキヤ秋葉原館1F開催期間: 2026年11月6日（金）〜11月23日（月）",
   "コトブキヤ日本橋1F開催期間: 2026年12月4日（金）〜12月20日（日）",
   "対象商品を税込2,000円購入ごとにランダムでポストカード1枚をプレゼント。レシート合算不可、通販は対象外、特典はなくなり次第終了。",
   "所恵美、舞浜歩、真壁瑞希のサジタリアス3人が旗を掲げ玉座に座るミニキャライラストを公開。",
   "アクアリウスのアイドルもミニキャラとして登場。"
  ],
  "via": "watch",
  "verify": "confirmed",
  "src_candidate_id": "202610161835-watch-3",
  "event_date": "2026-11-06",
  "deadline": "2026-12-20"
 }
]
